{
  "rejection_histogram": {
    "insufficient_support": 50,
    "out_of_bounds": 68,
    "overlap": 16
  },
  "pareto_candidate_fingerprints": [
    "195f5594247d36c85c34d3a7",
    "2e539107df812deed3c27399",
    "2f6591830a2de3c254755243",
    "482beb4319b9708b9d4212aa",
    "61cfb677ae7d45aed9302efc",
    "74c132853f61c26a4ef90d05",
    "868556f0c2c474e69d9cbe31",
    "a05ad387a1a9f3ef351ec038",
    "d6b3cb729ee071aa33127c6c",
    "e70e4c4b877e1e5b246f7690"
  ],
  "pareto_recall_at_k": 0.5,
  "geometry_oracle_fingerprint": "2e539107df812deed3c27399",
  "geometry_oracle_score": 0.6840942,
  "epsilon_optimal_recall_at_k": true
}
