{
  "rejection_histogram": {},
  "pareto_candidate_fingerprints": [
    "2b56b7d5f6151ed00f0c91fc",
    "4b96d38d77eb9bf739a2f226",
    "87a5e18dc147c6ee1cf7dc1e",
    "f8c293050dd1bc230daaa806"
  ],
  "pareto_recall_at_k": 1.0,
  "geometry_oracle_fingerprint": "f8c293050dd1bc230daaa806",
  "geometry_oracle_score": 0.80247365,
  "epsilon_optimal_recall_at_k": true
}
