{
  "rejection_histogram": {
    "insufficient_support": 20,
    "out_of_bounds": 43,
    "overlap": 2
  },
  "pareto_candidate_fingerprints": [
    "0b912f83b24cca25fb8063be",
    "344664e85ecc8b3c3ca65690",
    "4038537c6a577acfe1113aba",
    "8615bf08919b4fab059d1c94",
    "bcc032d9e305f6d74472257d",
    "eb74f32564c24888407699f8"
  ],
  "pareto_recall_at_k": 1.0,
  "geometry_oracle_fingerprint": "344664e85ecc8b3c3ca65690",
  "geometry_oracle_score": 0.8504545,
  "epsilon_optimal_recall_at_k": true
}
